{
  "runtime_protocol": "brokoli.task-runtime/v1",
  "bundle_digest": "sha256:6b86b273ff34fce19d6b804eff5a3f5747ada4eaa22f1d49c01e52ddb7875b4b",
  "payload_id": "python-any",
  "payload_digest": "sha256:d4735e3a265e16eee03f59718b9b5d03019c07d8b6c51f90da3a666eec13ab35",
  "execution_environment_digest": "sha256:4e07408562bedb8b60ce05c1decfe3ad16b72230967de01f640b7e4729b49fce",
  "interface_digest": "sha256:4b227777d4dd1fc61c6f884f48641d02b4d121d3fd328cb08b5531fcacdabf8a",
  "execution_profile": "standard@7"
}
